{
  "schemaVersion": "1.0",
  "packageId": "Fspure.Phase3.EmbedLib.Extra",
  "packageVersion": "1.0.0",
  "generatedAt": "2026-08-03T00:00:00.0000000+00:00",
  "generator": "phase3-fixture",
  "pureMethods": [
    {
      "fullName": "Fspure.Phase3.EmbedLib.Api.AuthorClaimedPure",
      "origin": "manual",
      "comment": "demonstrates pure-extra.json merge"
    }
  ]
}
