{
  "schemaVersion": "1.0",
  "packageId": "SinglePureResource",
  "packageVersion": "1.0.0",
  "generatedAt": "2026-08-03T00:00:00.0000000+00:00",
  "generator": "fspure-phase1-fixture",
  "pureMethods": [
    { "fullName": "SinglePureResource.Api.OnlyInSingle", "origin": "manual", "comment": "fixture" }
  ]
}
